    1 0.000000000 192.168.10.3 → 10.200.0.2   SSH 170 Server: Encrypted packet (len=116)
    2 0.010608646   10.200.0.2 → 192.168.10.3 SSH 170 Client: Encrypted packet (len=116)
    3 0.012021867 192.168.10.3 → 10.200.0.2   SSH 274 Server: Encrypted packet (len=220)
    4 0.025946851   10.200.0.2 → 192.168.10.3 SSH 266 Client: Encrypted packet (len=212)
    5 0.026067691 192.168.10.3 → 10.200.0.2   SSH 154 Server: Encrypted packet (len=100)
    6 0.067500548 192.168.10.3 → 10.200.0.2   SSH 154 Server: Encrypted packet (len=100)
    7 0.069050118   10.200.0.2 → 192.168.10.3 TCP 54 50462 → 22 [ACK] Seq=329 Ack=437 Win=8195 Len=0
    8 0.069855516   10.200.0.2 → 192.168.10.3 SSH 162 Client: Encrypted packet (len=108)
    9 0.071499090 192.168.10.3 → 10.200.0.2   SSH 154 Server: Encrypted packet (len=100)
   10 0.118458670   10.200.0.2 → 192.168.10.3 TCP 54 50462 → 22 [ACK] Seq=437 Ack=637 Win=8194 Len=0
   11 0.127321188 192.168.10.3 → 20.189.172.33 TCP 66 35384 → 443 [ACK] Seq=1 Ack=1 Win=502 Len=0 TSval=2217048989 TSecr=1885991801
   12 0.286432720 20.189.172.33 → 192.168.10.3 TCP 66 [TCP ACKed unseen segment] 443 → 35384 [ACK] Seq=1 Ack=2 Win=16383 Len=0 TSval=1885992961 TSecr=2217046810
   13 0.367747397 192.168.10.3 → 10.200.0.2   SSH 178 Server: Encrypted packet (len=124)
   14 0.375970398   10.200.0.2 → 192.168.10.3 SSH 178 Client: Encrypted packet (len=124)
   15 0.394648795 192.168.10.3 → 10.200.0.2   SSH 370 Server: Encrypted packet (len=316)
   16 0.400720995   10.200.0.2 → 192.168.10.3 SSH 210 Client: Encrypted packet (len=156)
   17 0.401465287   10.200.0.2 → 192.168.10.3 SSH 298 Client: Encrypted packet (len=244)
   18 0.401693598 192.168.10.3 → 10.200.0.2   TCP 54 22 → 50462 [ACK] Seq=1077 Ack=961 Win=10627 Len=0
   19 0.401877233 192.168.10.3 → 10.200.0.2   SSH 170 Server: Encrypted packet (len=116)
   20 0.443426472 192.168.10.3 → 10.200.0.2   SSH 402 Server: Encrypted packet (len=348)
   21 0.454578283   10.200.0.2 → 192.168.10.3 TCP 54 50462 → 22 [ACK] Seq=961 Ack=1541 Win=8196 Len=0
   22 0.457898894   10.200.0.2 → 192.168.10.3 SSH 194 Client: Encrypted packet (len=140)
   23 0.457899038   10.200.0.2 → 192.168.10.3 SSH 274 Client: Encrypted packet (len=220)
   24 0.457964619 192.168.10.3 → 10.200.0.2   TCP 54 22 → 50462 [ACK] Seq=1541 Ack=1321 Win=10627 Len=0
   25 0.471514626 192.168.10.3 → 10.200.0.2   SSH 146 Server: Encrypted packet (len=92)
   26 0.536928953 192.168.10.3 → 10.200.0.2   SSH 154 Server: Encrypted packet (len=100)
   27 0.547788082   10.200.0.2 → 192.168.10.3 TCP 54 50462 → 22 [ACK] Seq=1321 Ack=1633 Win=8196 Len=0
   28 0.559542253   10.200.0.2 → 192.168.10.3 SSH 154 Client: Encrypted packet (len=100)
   29 0.561181051 192.168.10.3 → 10.200.0.2   SSH 162 Server: Encrypted packet (len=108)
   30 0.602932218   10.200.0.2 → 192.168.10.3 TCP 54 50462 → 22 [ACK] Seq=1421 Ack=1841 Win=8195 Len=0
   31 0.604304411   10.200.0.2 → 192.168.10.3 SSH 162 Client: Encrypted packet (len=108)
   32 0.606004741 192.168.10.3 → 10.200.0.2   SSH 178 Server: Encrypted packet (len=124)
   33 0.652408876   10.200.0.2 → 192.168.10.3 TCP 54 50462 → 22 [ACK] Seq=1529 Ack=1965 Win=8195 Len=0
   34 0.659036849   10.200.0.2 → 192.168.10.3 SSH 138 Client: Encrypted packet (len=84)
   35 0.671407085   10.200.0.2 → 192.168.10.3 SSH 138 Client: Encrypted packet (len=84)
   36 0.671476098 192.168.10.3 → 10.200.0.2   TCP 54 22 → 50462 [ACK] Seq=1965 Ack=1697 Win=10627 Len=0
   37 0.712505316 192.168.10.3 → 10.200.0.2   SSH 154 Server: Encrypted packet (len=100)
   38 0.722372620   10.200.0.2 → 192.168.10.3 SSH 154 Client: Encrypted packet (len=100)
   39 0.763336369 192.168.10.3 → 10.200.0.2   TCP 54 22 → 50462 [ACK] Seq=2065 Ack=1797 Win=10627 Len=0
   40 1.049098890 192.168.10.3 → 10.200.0.2   SSH 146 Server: Encrypted packet (len=92)
   41 1.077171838   10.200.0.2 → 192.168.10.3 SSH 146 Client: Encrypted packet (len=92)
   42 1.077220070 192.168.10.3 → 10.200.0.2   TCP 54 22 → 50462 [ACK] Seq=2157 Ack=1889 Win=10627 Len=0
   43 1.078986836 192.168.10.3 → 10.200.0.2   SSH 154 Server: Encrypted packet (len=100)
   44 1.137098855   10.200.0.2 → 192.168.10.3 SSH 146 Client: Encrypted packet (len=92)
   45 1.138851117 192.168.10.3 → 10.200.0.2   SSH 154 Server: Encrypted packet (len=100)
   46 1.185845030   10.200.0.2 → 192.168.10.3 TCP 54 50462 → 22 [ACK] Seq=1981 Ack=2357 Win=8193 Len=0
   47 1.273411806 192.168.10.3 → 10.200.0.2   SSH 162 Server: Encrypted packet (len=108)
   48 1.287333206 192.168.10.3 → 20.189.172.33 TCP 66 [TCP Dup ACK 11#1] 35384 → 443 [ACK] Seq=1 Ack=1 Win=502 Len=0 TSval=2217050149 TSecr=1885992961
   49 1.369605675   10.200.0.2 → 192.168.10.3 TCP 54 50462 → 22 [ACK] Seq=1981 Ack=2465 Win=8193 Len=0
   50 1.447514257 20.189.172.33 → 192.168.10.3 TCP 66 [TCP Dup ACK 12#1] [TCP ACKed unseen segment] 443 → 35384 [ACK] Seq=1 Ack=2 Win=16383 Len=0 TSval=1885994122 TSecr=2217046810
   51 1.561176325 192.168.10.3 → 10.200.0.2   SSH 146 Server: Encrypted packet (len=92)
   52 1.607471328   10.200.0.2 → 192.168.10.3 SSH 154 Client: Encrypted packet (len=100)
   53 1.609174655 192.168.10.3 → 10.200.0.2   SSH 154 Server: Encrypted packet (len=100)
   54 1.630201139 192.168.10.3 → 10.200.0.2   SSH 146 Server: Encrypted packet (len=92)
   55 1.664687901   10.200.0.2 → 192.168.10.3 SSH 146 Client: Encrypted packet (len=92)
   56 1.666165475   10.200.0.2 → 192.168.10.3 SSH 146 Client: Encrypted packet (len=92)
   57 1.666218761 192.168.10.3 → 10.200.0.2   TCP 54 22 → 50462 [ACK] Seq=2749 Ack=2265 Win=10627 Len=0
   58 1.673316632 192.168.10.3 → 10.200.0.2   SSH 170 Server: Encrypted packet (len=116)
   59 1.763394741   10.200.0.2 → 192.168.10.3 TCP 54 50462 → 22 [ACK] Seq=2265 Ack=2865 Win=8191 Len=0
   60 2.072974622 192.168.10.3 → 10.200.0.2   SSH 146 Server: Encrypted packet (len=92)
   61 2.094749485   10.200.0.2 → 192.168.10.3 SSH 154 Client: Encrypted packet (len=100)
   62 2.096531540 192.168.10.3 → 10.200.0.2   SSH 154 Server: Encrypted packet (len=100)
   63 2.152730153   10.200.0.2 → 192.168.10.3 TCP 54 50462 → 22 [ACK] Seq=2365 Ack=3057 Win=8196 Len=0
   64 2.153874461   10.200.0.2 → 192.168.10.3 SSH 146 Client: Encrypted packet (len=92)
   65 2.154470189 192.168.10.3 → 10.200.0.2   SSH 154 Server: Encrypted packet (len=100)
   66 2.203772445   10.200.0.2 → 192.168.10.3 TCP 54 50462 → 22 [ACK] Seq=2457 Ack=3157 Win=8196 Len=0
   67 2.451413614 192.168.10.3 → 20.189.172.33 TCP 66 [TCP Dup ACK 11#2] 35384 → 443 [ACK] Seq=1 Ack=1 Win=502 Len=0 TSval=2217051313 TSecr=1885994122
   68 2.584944402 192.168.10.3 → 10.200.0.2   SSH 146 Server: Encrypted packet (len=92)
   69 2.610645889 20.189.172.33 → 192.168.10.3 TCP 66 [TCP Dup ACK 12#2] [TCP ACKed unseen segment] 443 → 35384 [ACK] Seq=1 Ack=2 Win=16383 Len=0 TSval=1885995286 TSecr=2217046810
   70 2.627689531   10.200.0.2 → 192.168.10.3 SSH 154 Client: Encrypted packet (len=100)
   71 2.629360179 192.168.10.3 → 10.200.0.2   SSH 154 Server: Encrypted packet (len=100)
   72 2.686011395   10.200.0.2 → 192.168.10.3 TCP 54 50462 → 22 [ACK] Seq=2557 Ack=3349 Win=8195 Len=0
   73 2.687314767   10.200.0.2 → 192.168.10.3 SSH 146 Client: Encrypted packet (len=92)
   74 2.688972763 192.168.10.3 → 10.200.0.2   SSH 154 Server: Encrypted packet (len=100)
   75 2.781647522   10.200.0.2 → 192.168.10.3 TCP 54 50462 → 22 [ACK] Seq=2649 Ack=3449 Win=8194 Len=0
   76 2.949645472 192.168.10.3 → 20.189.172.33 TCP 66 [TCP Previous segment not captured] 35384 → 443 [FIN, ACK] Seq=2 Ack=1 Win=502 Len=0 TSval=2217051811 TSecr=1885995286
   77 3.096323856 192.168.10.3 → 10.200.0.2   SSH 146 Server: Encrypted packet (len=92)
   78 3.108950424 20.189.172.33 → 192.168.10.3 TCP 66 [TCP ACKed unseen segment] 443 → 35384 [FIN, ACK] Seq=1 Ack=3 Win=16383 Len=0 TSval=1885995781 TSecr=2217051811
   79 3.109002105 192.168.10.3 → 20.189.172.33 TCP 66 35384 → 443 [ACK] Seq=3 Ack=2 Win=502 Len=0 TSval=2217051970 TSecr=1885995781
   80 3.112331636   10.200.0.2 → 192.168.10.3 SSH 154 Client: Encrypted packet (len=100)
   81 3.114266433 192.168.10.3 → 10.200.0.2   SSH 154 Server: Encrypted packet (len=100)
   82 3.168819079   10.200.0.2 → 192.168.10.3 TCP 54 50462 → 22 [ACK] Seq=2749 Ack=3641 Win=8194 Len=0
   83 3.171044660   10.200.0.2 → 192.168.10.3 SSH 146 Client: Encrypted packet (len=92)
   84 3.172761173 192.168.10.3 → 10.200.0.2   SSH 162 Server: Encrypted packet (len=108)
   85 3.269721129   10.200.0.2 → 192.168.10.3 TCP 54 50462 → 22 [ACK] Seq=2841 Ack=3749 Win=8193 Len=0
   86 3.430561661 192.168.10.3 → 10.200.0.2   SSH 146 Server: Encrypted packet (len=92)
   87 3.480307291   10.200.0.2 → 192.168.10.3 TCP 54 50462 → 22 [ACK] Seq=2841 Ack=3841 Win=8193 Len=0
   88 3.609539867 192.168.10.3 → 10.200.0.2   SSH 154 Server: Encrypted packet (len=100)
   89 3.631986144   10.200.0.2 → 192.168.10.3 SSH 146 Client: Encrypted packet (len=92)
   90 3.633751151 192.168.10.3 → 10.200.0.2   SSH 154 Server: Encrypted packet (len=100)
   91 3.679376119 192.168.10.3 → 10.200.0.2   SSH 146 Server: Encrypted packet (len=92)
   92 3.685088551   10.200.0.2 → 192.168.10.3 TCP 54 50462 → 22 [ACK] Seq=2933 Ack=4041 Win=8192 Len=0
   93 3.686216600   10.200.0.2 → 192.168.10.3 SSH 146 Client: Encrypted packet (len=92)
   94 3.687853996 192.168.10.3 → 10.200.0.2   SSH 154 Server: Encrypted packet (len=100)
   95 3.688319682   10.200.0.2 → 192.168.10.3 SSH 146 Client: Encrypted packet (len=92)
   96 3.689915520 192.168.10.3 → 10.200.0.2   SSH 154 Server: Encrypted packet (len=100)
   97 3.733647823   10.200.0.2 → 192.168.10.3 TCP 54 50462 → 22 [ACK] Seq=3117 Ack=4233 Win=8191 Len=0
   98 3.774457721   10.200.0.2 → 192.168.10.3 TCP 54 50462 → 22 [ACK] Seq=3117 Ack=4333 Win=8191 Len=0
   99 3.893278637 140.82.113.22 → 192.168.10.3 TLSv1.2 105 Application Data
  100 3.893278951 140.82.113.22 → 192.168.10.3 TLSv1.2 90 Application Data
  101 3.893326337 140.82.113.22 → 192.168.10.3 TCP 66 443 → 33196 [FIN, ACK] Seq=64 Ack=1 Win=309 Len=0 TSval=4097661409 TSecr=2550669791
  102 3.893392165 192.168.10.3 → 140.82.113.22 TCP 66 33196 → 443 [ACK] Seq=1 Ack=65 Win=1002 Len=0 TSval=2550789906 TSecr=4097661409
  103 3.893796686 192.168.10.3 → 140.82.113.22 TLSv1.2 122 Application Data
  104 3.894001099 192.168.10.3 → 140.82.113.22 TCP 66 33196 → 443 [FIN, ACK] Seq=57 Ack=65 Win=1002 Len=0 TSval=2550789906 TSecr=4097661409
  105 4.007100895 140.82.113.22 → 192.168.10.3 TCP 54 443 → 33196 [RST] Seq=65 Win=0 Len=0
  106 4.120909447 192.168.10.3 → 10.200.0.2   SSH 146 Server: Encrypted packet (len=92)
  107 4.130797638   10.200.0.2 → 192.168.10.3 SSH 154 Client: Encrypted packet (len=100)
  108 4.132731891 192.168.10.3 → 10.200.0.2   SSH 154 Server: Encrypted packet (len=100)
  109 4.185660426   10.200.0.2 → 192.168.10.3 TCP 54 50462 → 22 [ACK] Seq=3217 Ack=4525 Win=8196 Len=0
  110 4.186406272   10.200.0.2 → 192.168.10.3 SSH 146 Client: Encrypted packet (len=92)
  111 4.188344705 192.168.10.3 → 10.200.0.2   SSH 162 Server: Encrypted packet (len=108)
  112 4.281779701   10.200.0.2 → 192.168.10.3 TCP 54 50462 → 22 [ACK] Seq=3309 Ack=4633 Win=8196 Len=0
  113 4.632992824 192.168.10.3 → 10.200.0.2   SSH 154 Server: Encrypted packet (len=100)
  114 4.643098133   10.200.0.2 → 192.168.10.3 SSH 154 Client: Encrypted packet (len=100)
  115 4.644847423 192.168.10.3 → 10.200.0.2   SSH 162 Server: Encrypted packet (len=108)
  116 4.686781991   10.200.0.2 → 192.168.10.3 TCP 54 50462 → 22 [ACK] Seq=3409 Ack=4841 Win=8195 Len=0
  117 4.688114192   10.200.0.2 → 192.168.10.3 SSH 154 Client: Encrypted packet (len=100)
  118 4.689786063 192.168.10.3 → 10.200.0.2   SSH 154 Server: Encrypted packet (len=100)
  119 4.734912444   10.200.0.2 → 192.168.10.3 TCP 54 50462 → 22 [ACK] Seq=3509 Ack=4941 Win=8194 Len=0
  120 5.144996062 192.168.10.3 → 10.200.0.2   SSH 146 Server: Encrypted packet (len=92)
  121 5.203815144   10.200.0.2 → 192.168.10.3 SSH 146 Client: Encrypted packet (len=92)
  122 5.204470695 192.168.10.3 → 10.200.0.2   SSH 154 Server: Encrypted packet (len=100)
  123 5.249315627   10.200.0.2 → 192.168.10.3 SSH 146 Client: Encrypted packet (len=92)
  124 5.251240595 192.168.10.3 → 10.200.0.2   SSH 154 Server: Encrypted packet (len=100)
  125 5.301702611   10.200.0.2 → 192.168.10.3 TCP 54 50462 → 22 [ACK] Seq=3693 Ack=5233 Win=8193 Len=0
  126 5.403747586 192.168.10.3 → 10.200.0.2   SSH 178 Server: Encrypted packet (len=124)
  127 5.430108160 192.168.10.3 → 10.200.0.2   SSH 290 Server: Encrypted packet (len=236)
  128 5.437128143 192.168.10.3 → 10.200.0.2   SSH 178 Server: Encrypted packet (len=124)
  129 5.443167169 192.168.10.3 → 10.200.0.2   SSH 170 Server: Encrypted packet (len=116)
  130 5.446494160 192.168.10.3 → 10.200.0.2   SSH 154 Server: Encrypted packet (len=100)
  131 5.453319190   10.200.0.2 → 192.168.10.3 TCP 54 50462 → 22 [ACK] Seq=3693 Ack=5593 Win=8192 Len=0
  132 5.453853276   10.200.0.2 → 192.168.10.3 TCP 54 50462 → 22 [ACK] Seq=3693 Ack=5833 Win=8196 Len=0
  133 5.455833550   10.200.0.2 → 192.168.10.3 SSH 178 Client: Encrypted packet (len=124)
  134 5.461486963   10.200.0.2 → 192.168.10.3 SSH 394 Client: Encrypted packet (len=340)
  135 5.461528756 192.168.10.3 → 10.200.0.2   TCP 54 22 → 50462 [ACK] Seq=5933 Ack=4157 Win=10627 Len=0
  136 5.462176467   10.200.0.2 → 192.168.10.3 SSH 202 Client: Encrypted packet (len=148)
  137 5.463084093   10.200.0.2 → 192.168.10.3 SSH 162 Client: Encrypted packet (len=108)
  138 5.463112078 192.168.10.3 → 10.200.0.2   TCP 54 22 → 50462 [ACK] Seq=5933 Ack=4413 Win=10627 Len=0
  139 5.463883796 192.168.10.3 → 10.200.0.2   SSH 162 Server: Encrypted packet (len=108)
  140 5.507493111 192.168.10.3 → 10.200.0.2   SSH 226 Server: Encrypted packet (len=172)
  141 5.519942008   10.200.0.2 → 192.168.10.3 TCP 54 50462 → 22 [ACK] Seq=4413 Ack=6213 Win=8195 Len=0
  142 5.522808760   10.200.0.2 → 192.168.10.3 SSH 154 Client: Encrypted packet (len=100)
  143 5.563342647 192.168.10.3 → 10.200.0.2   TCP 54 22 → 50462 [ACK] Seq=6213 Ack=4513 Win=10627 Len=0
  144 5.657613345 192.168.10.3 → 10.200.0.2   SSH 154 Server: Encrypted packet (len=100)
  145 5.658722415   10.200.0.2 → 192.168.10.3 SSH 202 Client: Encrypted packet (len=148)
  146 5.658741483 192.168.10.3 → 10.200.0.2   TCP 54 22 → 50462 [ACK] Seq=6313 Ack=4661 Win=10627 Len=0
  147 5.660412801 192.168.10.3 → 10.200.0.2   SSH 162 Server: Encrypted packet (len=108)
  148 5.667124915   10.200.0.2 → 192.168.10.3 SSH 146 Client: Encrypted packet (len=92)
  149 5.668728882 192.168.10.3 → 10.200.0.2   SSH 154 Server: Encrypted packet (len=100)
  150 5.719866895   10.200.0.2 → 192.168.10.3 TCP 54 50462 → 22 [ACK] Seq=4753 Ack=6421 Win=8194 Len=0
  151 5.720697665   10.200.0.2 → 192.168.10.3 SSH 146 Client: Encrypted packet (len=92)
  152 5.722362429 192.168.10.3 → 10.200.0.2   SSH 154 Server: Encrypted packet (len=100)
  153 5.727198294 192.168.10.3 → 10.200.0.2   SSH 146 Server: Encrypted packet (len=92)
  154 5.746841652 192.168.10.3 → 10.200.0.2   SSH 154 Server: Encrypted packet (len=100)
  155 5.770569155   10.200.0.2 → 192.168.10.3 TCP 54 50462 → 22 [ACK] Seq=4845 Ack=6621 Win=8193 Len=0
  156 5.771016007   10.200.0.2 → 192.168.10.3 TCP 54 50462 → 22 [ACK] Seq=4845 Ack=6813 Win=8193 Len=0
  157 5.773497632   10.200.0.2 → 192.168.10.3 SSH 154 Client: Encrypted packet (len=100)
  158 5.774531594   10.200.0.2 → 192.168.10.3 SSH 146 Client: Encrypted packet (len=92)
  159 5.774565715 192.168.10.3 → 10.200.0.2   TCP 54 22 → 50462 [ACK] Seq=6813 Ack=5037 Win=10627 Len=0
  160 5.776278736 192.168.10.3 → 10.200.0.2   SSH 154 Server: Encrypted packet (len=100)
  161 5.868609586   10.200.0.2 → 192.168.10.3 TCP 54 50462 → 22 [ACK] Seq=5037 Ack=6913 Win=8192 Len=0
  162 6.169658095 192.168.10.3 → 10.200.0.2   SSH 146 Server: Encrypted packet (len=92)
  163 6.211653395   10.200.0.2 → 192.168.10.3 SSH 154 Client: Encrypted packet (len=100)
  164 6.213569594 192.168.10.3 → 10.200.0.2   SSH 162 Server: Encrypted packet (len=108)
  165 6.269137672   10.200.0.2 → 192.168.10.3 SSH 146 Client: Encrypted packet (len=92)
  166 6.270856204 192.168.10.3 → 10.200.0.2   SSH 154 Server: Encrypted packet (len=100)
  167 6.318791652   10.200.0.2 → 192.168.10.3 TCP 54 50462 → 22 [ACK] Seq=5229 Ack=7113 Win=8191 Len=0
  168 6.365753115   10.200.0.2 → 192.168.10.3 TCP 54 50462 → 22 [ACK] Seq=5229 Ack=7213 Win=8191 Len=0
  169 6.681128612 192.168.10.3 → 10.200.0.2   SSH 146 Server: Encrypted packet (len=92)
  170 6.735936247   10.200.0.2 → 192.168.10.3 SSH 146 Client: Encrypted packet (len=92)
  171 6.737771777 192.168.10.3 → 10.200.0.2   SSH 154 Server: Encrypted packet (len=100)
  172 6.751057639 192.168.10.3 → 10.200.0.2   SSH 146 Server: Encrypted packet (len=92)
  173 6.786070784   10.200.0.2 → 192.168.10.3 TCP 54 50462 → 22 [ACK] Seq=5321 Ack=7405 Win=8196 Len=0
  174 6.787091367   10.200.0.2 → 192.168.10.3 SSH 146 Client: Encrypted packet (len=92)
  175 6.788782181 192.168.10.3 → 10.200.0.2   SSH 162 Server: Encrypted packet (len=108)
  176 6.789410327   10.200.0.2 → 192.168.10.3 SSH 146 Client: Encrypted packet (len=92)
  177 6.791450025 192.168.10.3 → 10.200.0.2   SSH 154 Server: Encrypted packet (len=100)
  178 6.815637837 192.168.10.3 → 10.200.0.2   SSH 90 Server: Encrypted packet (len=36)
  179 6.835896562   10.200.0.2 → 192.168.10.3 TCP 54 50462 → 22 [ACK] Seq=5505 Ack=7605 Win=8195 Len=0
  180 6.836751333   10.200.0.2 → 192.168.10.3 TCP 54 50462 → 22 [ACK] Seq=5505 Ack=7741 Win=8195 Len=0
  181 6.875392209   10.200.0.2 → 192.168.10.3 SSH 154 Client: Encrypted packet (len=100)
  182 6.877161784 192.168.10.3 → 10.200.0.2   SSH 162 Server: Encrypted packet (len=108)
  183 6.921715178   10.200.0.2 → 192.168.10.3 TCP 54 50462 → 22 [ACK] Seq=5605 Ack=7849 Win=8194 Len=0
  184 7.192995569 192.168.10.3 → 10.200.0.2   SSH 146 Server: Encrypted packet (len=92)
  185 7.218916891   10.200.0.2 → 192.168.10.3 SSH 154 Client: Encrypted packet (len=100)
  186 7.220804863 192.168.10.3 → 10.200.0.2   SSH 154 Server: Encrypted packet (len=100)
  187 7.269823250   10.200.0.2 → 192.168.10.3 TCP 54 50462 → 22 [ACK] Seq=5705 Ack=8041 Win=8194 Len=0
  188 7.271121625   10.200.0.2 → 192.168.10.3 SSH 146 Client: Encrypted packet (len=92)
  189 7.272875781 192.168.10.3 → 10.200.0.2   SSH 154 Server: Encrypted packet (len=100)
  190 7.368598776   10.200.0.2 → 192.168.10.3 TCP 54 50462 → 22 [ACK] Seq=5797 Ack=8141 Win=8193 Len=0
  191 7.518601118 192.168.11.3 → 192.168.10.3 TCP 74 41736 → 2404 [SYN] Seq=0 Win=64860 Len=0 MSS=1410 SACK_PERM=1 TSval=4151174201 TSecr=0 WS=128
  192 7.518691012 192.168.10.3 → 192.168.11.3 TCP 74 2404 → 41736 [SYN, ACK] Seq=0 Ack=1 Win=64308 Len=0 MSS=1410 SACK_PERM=1 TSval=1450856042 TSecr=4151174201 WS=128
  193 7.518992518 192.168.11.3 → 192.168.10.3 TCP 66 41736 → 2404 [ACK] Seq=1 Ack=1 Win=64896 Len=0 TSval=4151174201 TSecr=1450856042
  194 7.519357212 192.168.11.3 → 192.168.10.3 IEC 60870-5-104 118 41736 → 2404 [PSH, ACK] Seq=1 Ack=1 Win=64896 Len=52 TSval=4151174202 TSecr=1450856042
  195 7.519372966 192.168.10.3 → 192.168.11.3 TCP 66 2404 → 41736 [ACK] Seq=1 Ack=53 Win=64256 Len=0 TSval=1450856043 TSecr=4151174202
  196 7.519472112 192.168.10.3 → 192.168.11.3 TCP 118 2404 → 41736 [PSH, ACK] Seq=1 Ack=53 Win=64256 Len=52 TSval=1450856043 TSecr=4151174202 [TCP segment of a reassembled PDU]
  197 7.519672494 192.168.11.3 → 192.168.10.3 TCP 66 41736 → 2404 [ACK] Seq=53 Ack=53 Win=64896 Len=0 TSval=4151174202 TSecr=1450856043
  198 7.519792188 192.168.11.3 → 192.168.10.3 TCP 106 41736 → 2404 [PSH, ACK] Seq=53 Ack=53 Win=64896 Len=40 TSval=4151174202 TSecr=1450856043 [TCP segment of a reassembled PDU]
  199 7.526683759 192.168.10.3 → 10.200.0.2   SSH 554 Server: Encrypted packet (len=500)
  200 7.554164584   10.200.0.2 → 192.168.10.3 SSH 490 Client: Encrypted packet (len=436)
  201 7.554958959   10.200.0.2 → 192.168.10.3 SSH 186 Client: Encrypted packet (len=132)
  202 7.554993065 192.168.10.3 → 10.200.0.2   TCP 54 22 → 50462 [ACK] Seq=8641 Ack=6365 Win=10627 Len=0
  203 7.556519860 192.168.10.3 → 10.200.0.2   SSH 154 Server: Encrypted packet (len=100)
  204 7.563337175 192.168.10.3 → 192.168.11.3 TCP 66 2404 → 41736 [ACK] Seq=53 Ack=93 Win=64256 Len=0 TSval=1450856087 TSecr=4151174202
  205 7.563656429 192.168.11.3 → 192.168.10.3 TCP 112 41736 → 2404 [PSH, ACK] Seq=93 Ack=53 Win=64896 Len=46 TSval=4151174246 TSecr=1450856087 [TCP segment of a reassembled PDU]
  206 7.563675875 192.168.10.3 → 192.168.11.3 TCP 66 2404 → 41736 [ACK] Seq=53 Ack=139 Win=64256 Len=0 TSval=1450856087 TSecr=4151174246
  207 7.603134235   10.200.0.2 → 192.168.10.3 TCP 54 50462 → 22 [ACK] Seq=6365 Ack=8741 Win=8196 Len=0
  208 7.605075047   10.200.0.2 → 192.168.10.3 SSH 162 Client: Encrypted packet (len=108)
  209 7.606746954 192.168.10.3 → 10.200.0.2   SSH 154 Server: Encrypted packet (len=100)
  210 7.701716554   10.200.0.2 → 192.168.10.3 TCP 54 50462 → 22 [ACK] Seq=6473 Ack=8841 Win=8196 Len=0
  211 7.704739279 192.168.10.3 → 10.200.0.2   SSH 154 Server: Encrypted packet (len=100)
  212 7.759290534   10.200.0.2 → 192.168.10.3 SSH 154 Client: Encrypted packet (len=100)
  213 7.760948756 192.168.10.3 → 10.200.0.2   SSH 154 Server: Encrypted packet (len=100)
  214 7.803130068   10.200.0.2 → 192.168.10.3 TCP 54 50462 → 22 [ACK] Seq=6573 Ack=9041 Win=8195 Len=0
  215 7.804091717   10.200.0.2 → 192.168.10.3 SSH 146 Client: Encrypted packet (len=92)
  216 7.805711200 192.168.10.3 → 10.200.0.2   SSH 154 Server: Encrypted packet (len=100)
  217 7.851407044   10.200.0.2 → 192.168.10.3 TCP 54 50462 → 22 [ACK] Seq=6665 Ack=9141 Win=8195 Len=0
  218 8.217377388 192.168.10.3 → 10.200.0.2   SSH 146 Server: Encrypted packet (len=92)
  219 8.265717523   10.200.0.2 → 192.168.10.3 SSH 154 Client: Encrypted packet (len=100)
  220 8.267403542 192.168.10.3 → 10.200.0.2   SSH 162 Server: Encrypted packet (len=108)
  221 8.287424919 192.168.10.3 → 10.200.0.2   SSH 146 Server: Encrypted packet (len=92)
  222 8.320969594   10.200.0.2 → 192.168.10.3 SSH 146 Client: Encrypted packet (len=92)
  223 8.321752217   10.200.0.2 → 192.168.10.3 TCP 54 50462 → 22 [ACK] Seq=6857 Ack=9433 Win=8194 Len=0
  224 8.322616797 192.168.10.3 → 10.200.0.2   SSH 154 Server: Encrypted packet (len=100)
  225 8.323024535   10.200.0.2 → 192.168.10.3 SSH 146 Client: Encrypted packet (len=92)
  226 8.324672432 192.168.10.3 → 10.200.0.2   SSH 154 Server: Encrypted packet (len=100)
  227 8.367973512   10.200.0.2 → 192.168.10.3 TCP 54 50462 → 22 [ACK] Seq=6949 Ack=9533 Win=8193 Len=0
  228 8.413103613   10.200.0.2 → 192.168.10.3 TCP 54 50462 → 22 [ACK] Seq=6949 Ack=9633 Win=8193 Len=0
  229 8.430206688 192.168.10.3 → 10.200.0.2   SSH 146 Server: Encrypted packet (len=92)
  230 8.514874390   10.200.0.2 → 192.168.10.3 TCP 54 50462 → 22 [ACK] Seq=6949 Ack=9725 Win=8193 Len=0
  231 8.519733841 192.168.10.3 → 192.168.11.3 TCP 112 2404 → 41736 [PSH, ACK] Seq=53 Ack=139 Win=64256 Len=46 TSval=1450857043 TSecr=4151174246 [TCP segment of a reassembled PDU]
  232 8.520415651 192.168.11.3 → 192.168.10.3 TCP 118 41736 → 2404 [PSH, ACK] Seq=139 Ack=99 Win=64896 Len=52 TSval=4151175203 TSecr=1450857043 [TCP segment of a reassembled PDU]
  233 8.520444844 192.168.10.3 → 192.168.11.3 TCP 66 2404 → 41736 [ACK] Seq=99 Ack=191 Win=64256 Len=0 TSval=1450857044 TSecr=4151175203
  234 8.529129902 192.168.10.3 → 10.200.0.2   SSH 202 Server: Encrypted packet (len=148)
  235 8.582934414   10.200.0.2 → 192.168.10.3 SSH 154 Client: Encrypted packet (len=100)
  236 8.585220755 192.168.10.3 → 10.200.0.2   SSH 154 Server: Encrypted packet (len=100)
  237 8.588440941   10.200.0.2 → 192.168.10.3 SSH 250 Client: Encrypted packet (len=196)
  238 8.590102661 192.168.10.3 → 10.200.0.2   SSH 154 Server: Encrypted packet (len=100)
  239 8.637929344   10.200.0.2 → 192.168.10.3 SSH 154 Client: Encrypted packet (len=100)
  240 8.639651539 192.168.10.3 → 10.200.0.2   SSH 154 Server: Encrypted packet (len=100)
  241 8.684302956   10.200.0.2 → 192.168.10.3 TCP 54 50462 → 22 [ACK] Seq=7345 Ack=10173 Win=8196 Len=0
  242 8.728988709 192.168.10.3 → 10.200.0.2   SSH 154 Server: Encrypted packet (len=100)
  243 8.740387367   10.200.0.2 → 192.168.10.3 SSH 154 Client: Encrypted packet (len=100)
  244 8.742112524 192.168.10.3 → 10.200.0.2   SSH 154 Server: Encrypted packet (len=100)
  245 8.785945508   10.200.0.2 → 192.168.10.3 TCP 54 50462 → 22 [ACK] Seq=7445 Ack=10373 Win=8196 Len=0
  246 8.787442104   10.200.0.2 → 192.168.10.3 SSH 146 Client: Encrypted packet (len=92)
  247 8.789153776 192.168.10.3 → 10.200.0.2   SSH 162 Server: Encrypted packet (len=108)
  248 8.834046750   10.200.0.2 → 192.168.10.3 TCP 54 50462 → 22 [ACK] Seq=7537 Ack=10481 Win=8195 Len=0
  249 9.241212954 192.168.10.3 → 10.200.0.2   SSH 146 Server: Encrypted packet (len=92)
  250 9.266459479   10.200.0.2 → 192.168.10.3 SSH 146 Client: Encrypted packet (len=92)
  251 9.268328142 192.168.10.3 → 10.200.0.2   SSH 162 Server: Encrypted packet (len=108)
  252 9.311411275 192.168.10.3 → 10.200.0.2   SSH 146 Server: Encrypted packet (len=92)
  253 9.320888686   10.200.0.2 → 192.168.10.3 TCP 54 50462 → 22 [ACK] Seq=7629 Ack=10773 Win=8194 Len=0
  254 9.321724760   10.200.0.2 → 192.168.10.3 SSH 146 Client: Encrypted packet (len=92)
  255 9.322941040   10.200.0.2 → 192.168.10.3 SSH 146 Client: Encrypted packet (len=92)
  256 9.322980457 192.168.10.3 → 10.200.0.2   TCP 54 22 → 50462 [ACK] Seq=10773 Ack=7813 Win=10627 Len=0
  257 9.323597333 192.168.10.3 → 10.200.0.2   SSH 178 Server: Encrypted packet (len=124)
  258 9.416335679   10.200.0.2 → 192.168.10.3 TCP 54 50462 → 22 [ACK] Seq=7813 Ack=10897 Win=8194 Len=0
  259 9.520022819 192.168.10.3 → 192.168.11.3 TCP 118 2404 → 41736 [PSH, ACK] Seq=99 Ack=191 Win=64256 Len=52 TSval=1450858043 TSecr=4151175203 [TCP segment of a reassembled PDU]
  260 9.520763143 192.168.11.3 → 192.168.10.3 IEC 60870-5-104 106 <ERR prefix 27 bytes> <- U (<ERR>) 
  261 9.520786363 192.168.10.3 → 192.168.11.3 TCP 66 2404 → 41736 [ACK] Seq=151 Ack=231 Win=64256 Len=0 TSval=1450858044 TSecr=4151176203
  262 9.521028312 192.168.11.3 → 192.168.10.3 IEC 60870-5-104 112 <ERR prefix 40 bytes> <- U (TESTFR act) 
  263 9.521032374 192.168.10.3 → 192.168.11.3 TCP 66 2404 → 41736 [ACK] Seq=151 Ack=277 Win=64256 Len=0 TSval=1450858044 TSecr=4151176204
  264 9.526950580 192.168.10.3 → 10.200.0.2   SSH 202 Server: Encrypted packet (len=148)
  265 9.538143912   10.200.0.2 → 192.168.10.3 SSH 202 Client: Encrypted packet (len=148)
  266 9.539917461 192.168.10.3 → 10.200.0.2   SSH 154 Server: Encrypted packet (len=100)
  267 9.587290895   10.200.0.2 → 192.168.10.3 TCP 54 50462 → 22 [ACK] Seq=7961 Ack=11145 Win=8193 Len=0
  268 9.588412140   10.200.0.2 → 192.168.10.3 SSH 162 Client: Encrypted packet (len=108)
  269 9.590142255 192.168.10.3 → 10.200.0.2   SSH 162 Server: Encrypted packet (len=108)
  270 9.635224355   10.200.0.2 → 192.168.10.3 TCP 54 50462 → 22 [ACK] Seq=8069 Ack=11253 Win=8192 Len=0
